{
  "agent_id": "aara-business-analyst",
  "agent_version": "0.1.0",
  "rubric_version": "0.1.0",
  "generated_at": "2026-07-05T12:34:12Z",
  "owners": {
    "business_owner": "Raja Shekar Bollam",
    "technical_owner": "Raja Shekar Bollam (acting engineering lead)"
  },
  "autonomy": {
    "level": 2,
    "justification": "classifier: Drafting (risk tier medium, score 4, policy allowed)",
    "risk_tier": "medium"
  },
  "areas": [
    {
      "area": "Business scope and ownership",
      "weight": 10,
      "checks_total": 3,
      "checks_passed": 3,
      "score": 10,
      "evidence": [
        {
          "check": "intake-valid",
          "result": "pass",
          "mechanism": "schema-validation",
          "evidence_ref": "../agents/aara-business-analyst/agent-intake.yaml"
        },
        {
          "check": "owners-named",
          "result": "pass",
          "mechanism": "schema-validation",
          "evidence_ref": "../agents/aara-business-analyst/agent-intake.yaml"
        },
        {
          "check": "outcomes-stated",
          "result": "pass",
          "mechanism": "schema-validation",
          "evidence_ref": "../agents/aara-business-analyst/agent-intake.yaml"
        }
      ]
    },
    {
      "area": "Autonomy and approval boundaries",
      "weight": 15,
      "checks_total": 4,
      "checks_passed": 4,
      "score": 15,
      "evidence": [
        {
          "check": "classification-current",
          "result": "pass",
          "mechanism": "schema-validation",
          "evidence_ref": "../agents/aara-business-analyst/classification.json"
        },
        {
          "check": "signoffs-recorded",
          "result": "pass",
          "mechanism": "catalog-record",
          "evidence_ref": "../agents/aara-business-analyst/signoffs.json"
        },
        {
          "check": "manifest-valid",
          "result": "pass",
          "mechanism": "contract-lint",
          "evidence_ref": "../examples/ba-agent.manifest.yaml"
        },
        {
          "check": "write-boundaries",
          "result": "pass",
          "mechanism": "contract-lint",
          "evidence_ref": "../examples/ba-agent.manifest.yaml"
        }
      ]
    },
    {
      "area": "MCP tool contract completeness",
      "weight": 15,
      "checks_total": 4,
      "checks_passed": 3,
      "score": 11.25,
      "evidence": [
        {
          "check": "contracts-exist",
          "result": "pass",
          "mechanism": "contract-lint",
          "evidence_ref": "../tool-contracts"
        },
        {
          "check": "contracts-lint",
          "result": "pass",
          "mechanism": "contract-lint",
          "evidence_ref": "../tool-contracts"
        },
        {
          "check": "contracts-pinned",
          "result": "pass",
          "mechanism": "contract-lint",
          "evidence_ref": "../examples/ba-agent.manifest.yaml"
        },
        {
          "check": "manifest-agent-match",
          "result": "fail",
          "mechanism": "schema-validation",
          "evidence_ref": "../examples/ba-agent.manifest.yaml"
        }
      ]
    },
    {
      "area": "Identity and permissions",
      "weight": 15,
      "checks_total": 3,
      "checks_passed": 2,
      "score": 10,
      "evidence": [
        {
          "check": "identity-valid",
          "result": "pass",
          "mechanism": "schema-validation",
          "evidence_ref": "../agents/aara-business-analyst/agent-identity-spec.json"
        },
        {
          "check": "identity-complete",
          "result": "fail",
          "mechanism": "schema-validation",
          "evidence_ref": "../agents/aara-business-analyst/agent-identity-spec.json"
        },
        {
          "check": "identity-scopes-match",
          "result": "pass",
          "mechanism": "schema-validation",
          "evidence_ref": "../agents/aara-business-analyst/agent-identity-spec.json"
        }
      ]
    },
    {
      "area": "Data and source-of-truth mapping",
      "weight": 10,
      "checks_total": 3,
      "checks_passed": 3,
      "score": 10,
      "evidence": [
        {
          "check": "evidence-contract-valid",
          "result": "pass",
          "mechanism": "schema-validation",
          "evidence_ref": "../agents/aara-business-analyst/data-evidence-contract.json"
        },
        {
          "check": "domains-mapped",
          "result": "pass",
          "mechanism": "schema-validation",
          "evidence_ref": "../agents/aara-business-analyst/data-evidence-contract.json"
        },
        {
          "check": "memory-citation-gate",
          "result": "pass",
          "mechanism": "harness-gate",
          "evidence_ref": "aapctl prove: memory-citation gates"
        }
      ]
    },
    {
      "area": "Evaluation plan and test coverage",
      "weight": 15,
      "checks_total": 4,
      "checks_passed": 3,
      "score": 11.25,
      "evidence": [
        {
          "check": "eval-plan-sections",
          "result": "pass",
          "mechanism": "schema-validation",
          "evidence_ref": "../agents/aara-business-analyst/evaluation-plan.md"
        },
        {
          "check": "eval-safety-section",
          "result": "pass",
          "mechanism": "schema-validation",
          "evidence_ref": "../agents/aara-business-analyst/evaluation-plan.md"
        },
        {
          "check": "eval-gate-configured",
          "result": "pass",
          "mechanism": "contract-lint",
          "evidence_ref": "../examples/ba-agent.manifest.yaml"
        },
        {
          "check": "eval-runs-present",
          "result": "fail",
          "mechanism": "eval-run",
          "evidence_ref": "../agents/aara-business-analyst/eval-runs"
        }
      ]
    },
    {
      "area": "Security and governance controls",
      "weight": 10,
      "checks_total": 5,
      "checks_passed": 4,
      "score": 8,
      "evidence": [
        {
          "check": "asi-checklist-complete",
          "result": "fail",
          "mechanism": "schema-validation",
          "evidence_ref": "../agents/aara-business-analyst/security-governance-checklist.md"
        },
        {
          "check": "proof-tool-denial",
          "result": "pass",
          "mechanism": "harness-gate",
          "evidence_ref": "aapctl prove: tool-denial gates"
        },
        {
          "check": "proof-memory-isolation",
          "result": "pass",
          "mechanism": "harness-gate",
          "evidence_ref": "aapctl prove: memory gates"
        },
        {
          "check": "proof-audit-chain",
          "result": "pass",
          "mechanism": "harness-gate",
          "evidence_ref": "aapctl prove: audit gates"
        },
        {
          "check": "prompt-injection-gate",
          "result": "pass",
          "mechanism": "harness-gate",
          "evidence_ref": "aapctl prove: prompt-injection tool-escalation gates"
        }
      ]
    },
    {
      "area": "Compliance evidence",
      "weight": 5,
      "checks_total": 2,
      "checks_passed": 1,
      "score": 2.5,
      "evidence": [
        {
          "check": "compliance-map-sections",
          "result": "pass",
          "mechanism": "schema-validation",
          "evidence_ref": "../agents/aara-business-analyst/compliance-evidence-map.md"
        },
        {
          "check": "compliance-complete",
          "result": "fail",
          "mechanism": "schema-validation",
          "evidence_ref": "../agents/aara-business-analyst/compliance-evidence-map.md"
        }
      ]
    },
    {
      "area": "Export and build readiness",
      "weight": 5,
      "checks_total": 3,
      "checks_passed": 3,
      "score": 5,
      "evidence": [
        {
          "check": "artifacts-complete",
          "result": "pass",
          "mechanism": "schema-validation",
          "evidence_ref": "../agents/aara-business-analyst"
        },
        {
          "check": "telemetry-payload-mode",
          "result": "pass",
          "mechanism": "contract-lint",
          "evidence_ref": "../examples/ba-agent.manifest.yaml"
        },
        {
          "check": "export-roundtrip",
          "result": "pass",
          "mechanism": "export-roundtrip",
          "evidence_ref": "../agents/aara-business-analyst/export-verification.json"
        }
      ]
    }
  ],
  "critical_blockers": [],
  "score": 83,
  "verdict": "defer",
  "approvals_required": [
    {
      "role": "business-owner"
    },
    {
      "role": "enterprise-ai-architect"
    }
  ]
}
